{
  "schemaVersion": "1.0.0",
  "source": "ICMR-NIN RDA (simplified) + IAP/WHO growth framing. Demo targets, not a medical diagnosis.",
  "ageBands": [
    {
      "id": "0-2",
      "ageMinMonths": 0,
      "ageMaxMonths": 23,
      "label": "First foods",
      "focus": ["milk feeds", "iron-rich mash", "upright after bottles"],
      "targets": { "energyKcal": 800, "proteinG": 10.5, "calciumMg": 500, "ironMg": 8, "vitaminDIU": 400, "fiberG": 8 },
      "note": "Under 2 — follow the feeding plan, not adult BMI cuts."
    },
    {
      "id": "2-5",
      "ageMinMonths": 24,
      "ageMaxMonths": 59,
      "label": "Playgroup & preschool",
      "focus": ["calcium", "iron", "colourful veg", "no packaged juice"],
      "targets": { "energyKcal": 1110, "proteinG": 16, "calciumMg": 500, "ironMg": 9, "vitaminDIU": 400, "fiberG": 15 },
      "note": "Pediatric targets, not calorie ceilings."
    },
    {
      "id": "5-8",
      "ageMinMonths": 60,
      "ageMaxMonths": 95,
      "label": "Early school",
      "focus": ["fiber", "iron", "shared family thali"],
      "targets": { "energyKcal": 1360, "proteinG": 23, "calciumMg": 550, "ironMg": 13, "vitaminDIU": 400, "fiberG": 20 },
      "note": "Growth fuel score from nutrient quality."
    },
    {
      "id": "8-12",
      "ageMinMonths": 96,
      "ageMaxMonths": 144,
      "label": "Tween fuel",
      "focus": ["calcium", "iron", "vitamin D", "no body-shame UI"],
      "targets": { "energyKcal": 2100, "proteinG": 33, "calciumMg": 850, "ironMg": 21, "vitaminDIU": 600, "fiberG": 26 },
      "note": "Hide calorie ceilings. Coach nutrient quality."
    }
  ],
  "bmiOverlays": {
    "infant": {
      "growthCue": "Milk feeds first. Offer iron-rich mash when ready. No BMI cuts under 2.",
      "energyAdjKcal": 0,
      "extraSnack": false,
      "playMinutes": 0
    },
    "under": {
      "growthCue": "Needs extra energy: add a full-fat snack (curd, avocado, banana). This is growth fuel, not a diet.",
      "energyAdjKcal": 150,
      "extraSnack": true,
      "playMinutes": 20
    },
    "healthy": {
      "growthCue": "Balanced plate: half colour, quarter protein (dal/beans/egg), quarter grain.",
      "energyAdjKcal": 0,
      "extraSnack": false,
      "playMinutes": 30
    },
    "watch": {
      "growthCue": "Grow with veg volume, water, and 30 minutes of play after school. No calorie ceilings.",
      "energyAdjKcal": 0,
      "extraSnack": false,
      "playMinutes": 30
    },
    "high": {
      "growthCue": "More sabzi, water first, fruit not juice, active play. Nutrient quality over restriction.",
      "energyAdjKcal": 0,
      "extraSnack": false,
      "playMinutes": 40
    }
  },
  "recipes": [
    {
      "id": "milk-feed",
      "name": "Breastmilk or formula as planned",
      "slot": "breakfast",
      "ageBands": ["0-2"],
      "diet": ["vegetarian", "nut-free", "dairy-free"],
      "allergens": [],
      "avoidIf": [],
      "tip": "Hold upright 15 minutes if reflux is on file. No bottle in the crib.",
      "ingredients": [{ "item": "milk feed", "qty": 1, "unit": "feed", "grocery": "Infant formula (if used)" }],
      "portionByBand": { "0-2": 1, "2-5": 0, "5-8": 0, "8-12": 0 },
      "nutrients": { "energyKcal": 150, "proteinG": 3, "calciumMg": 120, "ironMg": 1.2, "vitaminDIU": 75, "fiberG": 0 },
      "keywords": ["formula", "breast", "milk", "bottle"]
    },
    {
      "id": "ragi-banana",
      "name": "Ragi porridge + mashed banana",
      "slot": "lunch",
      "ageBands": ["0-2", "2-5"],
      "diet": ["vegetarian", "nut-free", "dairy-free"],
      "allergens": [],
      "avoidIf": [],
      "tip": "Iron-rich first food. Thin with warm water, not cow milk, if dairy is not yet on file.",
      "ingredients": [
        { "item": "ragi flour", "qty": 30, "unit": "g", "grocery": "Ragi flour" },
        { "item": "banana", "qty": 0.5, "unit": "fruit", "grocery": "Bananas" }
      ],
      "portionByBand": { "0-2": 0.6, "2-5": 1, "5-8": 0, "8-12": 0 },
      "nutrients": { "energyKcal": 180, "proteinG": 4, "calciumMg": 80, "ironMg": 2.4, "vitaminDIU": 0, "fiberG": 4 },
      "keywords": ["ragi", "banana", "porridge", "cereal"]
    },
    {
      "id": "poha-fruit",
      "name": "Vegetable poha + seasonal fruit",
      "slot": "breakfast",
      "ageBands": ["2-5", "5-8", "8-12"],
      "diet": ["vegetarian", "jain", "nut-free", "dairy-free"],
      "allergens": [],
      "avoidIf": ["peanut"],
      "swap": "Skip peanuts/sev. Use roasted chana or sunflower seeds.",
      "tip": "Flattened rice with peas and carrot. Fruit, not juice.",
      "ingredients": [
        { "item": "poha", "qty": 60, "unit": "g", "grocery": "Poha (flattened rice)" },
        { "item": "peas & carrot", "qty": 40, "unit": "g", "grocery": "Mixed vegetables" },
        { "item": "fruit", "qty": 1, "unit": "bowl", "grocery": "Seasonal fruit" }
      ],
      "portionByBand": { "0-2": 0.3, "2-5": 0.7, "5-8": 1, "8-12": 1.2 },
      "nutrients": { "energyKcal": 280, "proteinG": 6, "calciumMg": 30, "ironMg": 2.1, "vitaminDIU": 0, "fiberG": 5 },
      "keywords": ["poha", "fruit", "breakfast"]
    },
    {
      "id": "idli-sambar",
      "name": "Idli, sambar, coconut chutney",
      "slot": "breakfast",
      "ageBands": ["2-5", "5-8", "8-12"],
      "diet": ["vegetarian", "nut-free", "dairy-free"],
      "allergens": [],
      "avoidIf": [],
      "tip": "Fermented batter helps iron uptake. Skip coconut if texture is hard for toddlers — offer sambar only.",
      "ingredients": [
        { "item": "idli", "qty": 3, "unit": "pcs", "grocery": "Idli rice / urad dal" },
        { "item": "sambar", "qty": 150, "unit": "ml", "grocery": "Toor dal + sambar veg" },
        { "item": "coconut chutney", "qty": 30, "unit": "g", "grocery": "Fresh coconut" }
      ],
      "portionByBand": { "0-2": 0.4, "2-5": 0.7, "5-8": 1, "8-12": 1.25 },
      "nutrients": { "energyKcal": 320, "proteinG": 11, "calciumMg": 40, "ironMg": 2.8, "vitaminDIU": 0, "fiberG": 6 },
      "keywords": ["idli", "sambar", "chutney", "dosa"]
    },
    {
      "id": "moong-chilla",
      "name": "Moong chilla + mint chutney",
      "slot": "breakfast",
      "ageBands": ["2-5", "5-8", "8-12"],
      "diet": ["vegetarian", "jain", "nut-free", "dairy-free"],
      "allergens": [],
      "avoidIf": ["egg"],
      "swap": "No egg wash. Pan with oil only.",
      "tip": "High iron lentil crepe. Pair with a vitamin-C fruit.",
      "ingredients": [
        { "item": "moong dal batter", "qty": 80, "unit": "g", "grocery": "Moong dal" },
        { "item": "spinach", "qty": 20, "unit": "g", "grocery": "Spinach" },
        { "item": "mint chutney", "qty": 20, "unit": "g", "grocery": "Mint + coriander" }
      ],
      "portionByBand": { "0-2": 0.3, "2-5": 0.7, "5-8": 1, "8-12": 1.2 },
      "nutrients": { "energyKcal": 260, "proteinG": 14, "calciumMg": 50, "ironMg": 3.2, "vitaminDIU": 0, "fiberG": 7 },
      "keywords": ["chilla", "moong", "cheela", "pancake"]
    },
    {
      "id": "dal-rice-sabzi",
      "name": "Dal, jeera rice, two sabzi",
      "slot": "lunch",
      "ageBands": ["2-5", "5-8", "8-12"],
      "diet": ["vegetarian", "jain", "nut-free", "dairy-free"],
      "allergens": [],
      "avoidIf": [],
      "tip": "Family one-pot. Same spices, smaller cut for little ones.",
      "ingredients": [
        { "item": "toor dal", "qty": 40, "unit": "g", "grocery": "Toor dal" },
        { "item": "rice", "qty": 50, "unit": "g", "grocery": "Rice" },
        { "item": "beans palya", "qty": 80, "unit": "g", "grocery": "Green beans" },
        { "item": "carrot sabzi", "qty": 80, "unit": "g", "grocery": "Carrots" }
      ],
      "portionByBand": { "0-2": 0.35, "2-5": 0.7, "5-8": 1, "8-12": 1.3 },
      "nutrients": { "energyKcal": 420, "proteinG": 14, "calciumMg": 55, "ironMg": 3.5, "vitaminDIU": 0, "fiberG": 9 },
      "keywords": ["dal", "rice", "sabzi", "thali", "sambar"]
    },
    {
      "id": "roti-dal-palak",
      "name": "Roti, dal tadka, palak",
      "slot": "dinner",
      "ageBands": ["2-5", "5-8", "8-12"],
      "diet": ["vegetarian", "nut-free", "dairy-free"],
      "allergens": ["gluten"],
      "avoidIf": [],
      "swap": "Jowar or ragi roti if gluten-free is needed.",
      "tip": "Iron from palak + vitamin C salad. Ghee optional, skip if dairy-free.",
      "ingredients": [
        { "item": "roti", "qty": 2, "unit": "pcs", "grocery": "Atta" },
        { "item": "dal tadka", "qty": 150, "unit": "ml", "grocery": "Toor dal" },
        { "item": "palak", "qty": 80, "unit": "g", "grocery": "Spinach" }
      ],
      "portionByBand": { "0-2": 0.25, "2-5": 0.65, "5-8": 1, "8-12": 1.3 },
      "nutrients": { "energyKcal": 380, "proteinG": 13, "calciumMg": 90, "ironMg": 4.1, "vitaminDIU": 0, "fiberG": 8 },
      "keywords": ["roti", "chapati", "palak", "spinach", "dal"]
    },
    {
      "id": "khichdi-kadhi",
      "name": "Moong khichdi + cucumber",
      "slot": "dinner",
      "ageBands": ["0-2", "2-5", "5-8"],
      "diet": ["vegetarian", "jain", "nut-free", "dairy-free"],
      "allergens": [],
      "avoidIf": [],
      "swap": "Skip kadhi/curd if dairy is not on file — serve cucumber + dal water.",
      "tip": "Gentle on tummies. Soft mash for first foods.",
      "ingredients": [
        { "item": "moong-rice khichdi", "qty": 150, "unit": "g", "grocery": "Moong dal + rice" },
        { "item": "cucumber", "qty": 40, "unit": "g", "grocery": "Cucumber" }
      ],
      "portionByBand": { "0-2": 0.6, "2-5": 0.9, "5-8": 1, "8-12": 1.1 },
      "nutrients": { "energyKcal": 300, "proteinG": 10, "calciumMg": 35, "ironMg": 2.2, "vitaminDIU": 0, "fiberG": 5 },
      "keywords": ["khichdi", "kitchari", "moong", "rice"]
    },
    {
      "id": "veg-pulao",
      "name": "Vegetable pulao + raita or cucumber",
      "slot": "lunch",
      "ageBands": ["5-8", "8-12"],
      "diet": ["vegetarian", "nut-free"],
      "allergens": ["dairy"],
      "avoidIf": ["dairy", "lactose"],